id_video,fecha_recuperacion,fecha_publicacion,reproducciones,nombre_usuario,titulo,etiquetas,url_video,url_perfil
7082385712422653189,2024-12-02 17:11:41.497203,2022-4-3,111.2K,edteam,¡Aprende Notion en EDteam! 👨‍💻 ,#notion #notionapp #notiontips #notiontutorial #aprendenotiktok ,https://www.tiktok.com/@edteam/video/7082385712422653189,https://www.tiktok.com/@edteam
7353051032278076678,2024-12-02 17:11:41.509018,4-1,155.4K,maiteuralde,¿Qué quisieras aprender de Notion? 30 tips en 30 días para que aprendas a usar Notion. Notion es una aplicación con la que podrás crear tu propio sistema de productividad como tú lo quieras hacer. En estos 30 tips te voy a enseñar cada una de las herramientas que tiene Notion para que puedas implementarlas. #,#productividad #tareas #notionapp #notion ,https://www.tiktok.com/@maiteuralde/video/7353051032278076678,https://www.tiktok.com/@maiteuralde
7361417567560273185,2024-12-02 17:11:41.523017,4-24,34.1K,tu.daily.notion,Respuesta a ,@mrcrarcos #PlantillaNotion #NotionApp #NotionEnEspañol #Notion #AprendeNotion ,https://www.tiktok.com/@tu.daily.notion/video/7361417567560273185,https://www.tiktok.com/@tu.daily.notion
7360935093034175777,2024-12-02 17:11:41.534020,4-22,83.7K,notionconcarlos,"Si te gustaria aprender a usar Notion desde el celular, te tengo una sorpresa, en mi canal de Youtube tenfo un tutorial completo mostrandote como hacerlo! ",#notion #notionapp #notiontemplate #notiontok ,https://www.tiktok.com/@notionconcarlos/video/7360935093034175777,https://www.tiktok.com/@notionconcarlos
7443911768646225174,2024-12-02 17:11:41.547039,Hace 2 h,1577,notionconcarlos,Como crear un Planner de tareas con Notion ,#notion #notionapp #notiontemplate #notiontok #notiontutorial #notiontips #notionenespañol #notionplanner ,https://www.tiktok.com/@notionconcarlos/video/7443911768646225174,https://www.tiktok.com/@notionconcarlos
7200333967881555202,2024-12-02 17:11:41.558968,2023-2-15,5.8M,heyeaslo,"Who’s learning Notion? Ask me anything, I’m here to help! ",#notion #notionapp #notiontok #notiontips #notiontutorial ,https://www.tiktok.com/@heyeaslo/video/7200333967881555202,https://www.tiktok.com/@heyeaslo
7332218031919156485,2024-12-02 17:11:41.570166,2-5,53K,maiteuralde,Notion Calendar la nueva funcionalidad de Notion que compite con Google Calendar ,#notionapp #notion #notioncalendar ,https://www.tiktok.com/@maiteuralde/video/7332218031919156485,https://www.tiktok.com/@maiteuralde
7394433108302515487,2024-12-02 17:11:41.582165,7-22,605.4K,flourishplanner,Check out my Notion templates available on theflourishplanner.com ,#notion #notiontutorial #notiontemplate #flourishplanner ,https://www.tiktok.com/@flourishplanner/video/7394433108302515487,https://www.tiktok.com/@flourishplanner
7443872155546209591,2024-12-02 17:11:41.593765,Hace 5 h,1458,hey_planner,"Empieza este 2025 usando Notion, la herramientas mas completa para organizar y planificar ru vida 📈🚀 ",#agendaspersonalizadas #agendasdigitales #notionplantilla #hacksdeproductividad #organizacion #metas2025 ,https://www.tiktok.com/@hey_planner/video/7443872155546209591,https://www.tiktok.com/@hey_planner
7363425517208358149,2024-12-02 17:11:41.604861,4-29,4376,maiteuralde,"La inteligencia artificial dentro de Notion 🤖 Notion cuenta con su propia herramienta de inteligencia artificial que te ayudará con estas 3 cosas: 1️⃣ Obtener respuestas: es un chat con inteligencia artificial al que puedes hacerle preguntas y te dará respuestas basándose en los contenidos dentro de tu Notion. Ideal para equipos de trabajo. 2️⃣ Generar contenidos: Es tu asistente de escritura. Podrás hacer lluvias de ideas, escribir contenidos, hacer resúmenes, reescribir con otro tono y más cosas. 3️⃣ Autocompletado: Notion IA analizará la información en una base de datos para generar contenidos como: resúmenes, próximos pasos, listas de tareas, entre otros. La verdad es una herramienta bastante útil. Claro que puede parecerse a ChatGPT solo que esta IA va a tener acceso a tu información dentro de Notion y eso es algo que ChatGPT no hace. Esta es una función premium de Notion que cuesta $8/mes por usuario. Me parece un precio bastante justo. –– 💡 Si quieres usar Notion y prefieres tener un sistema de organización ya creado, échale un vistazo al Hub de mi Negocio en mi página web, una plantilla supercompleta con la que podrás gestionar todas las áreas de tu negocio de forma sencilla. 🔗 www.maiteuralde.com ",#notion #notionapp #notiontips #productividad ,https://www.tiktok.com/@maiteuralde/video/7363425517208358149,https://www.tiktok.com/@maiteuralde
7443490261772045600,2024-12-02 17:11:41.617844,Hace 1 día(s),518,martabarque,Notion tour ,#notion #notiontour #notionapp #notiontemplate #estudiante ,https://www.tiktok.com/@martabarque/video/7443490261772045600,https://www.tiktok.com/@martabarque
7143325603394014470,2024-12-02 17:11:41.630832,2022-9-14,30.9K,michiyal.yt,Cuando te descargas Notion por primera vez y juras que te va a resolver la vida entera 🤧. ¿A alguien más le ha pasado? ,#michiyal #notion #notionapp #notiontok #organization #adhd #diseño #diseñadorgrafico #trabajocreativo #creativos #arteydiseño #diseñográfico #estudiantes @notionhq ,https://www.tiktok.com/@michiyal.yt/video/7143325603394014470,https://www.tiktok.com/@michiyal.yt
7388691093841251589,2024-12-02 17:11:41.642553,7-6,9091,.matthsggf,"¿Para qué sirve notion en el shifting?!!★. Holaa, espero que con esta información pueda ayudar un poco a los baby shifters que quieran usar notion para sus guiones💗 ",#shifting #shiftingrealities #parati #fypシ ,https://www.tiktok.com/@.matthsggf/video/7388691093841251589,https://www.tiktok.com/@.matthsggf
7105810152237829382,2024-12-02 17:11:41.653552,2022-6-5,6235,organizateconmari,Empecemos juntos con Notion! 💕 ,#notionapp #organize ,https://www.tiktok.com/@organizateconmari/video/7105810152237829382,https://www.tiktok.com/@organizateconmari
7386445876870253830,2024-12-02 17:11:41.664553,6-30,69.1K,izu_sweet,𖥨┉┈ ˓ Tutorial como hacer tus horarios en Notion! (les recomiendo que lo hagan por PC como yo). PD: disculpen la calidad (⁠｡⁠ŏ⁠﹏⁠ŏ⁠) ,#fyp #noflop💔 #paratiiiiiiiiiiiiiiiiiiiiiiiiiiiiiii #viral #tiktok #notion #tutorial ,https://www.tiktok.com/@izu_sweet/video/7386445876870253830,https://www.tiktok.com/@izu_sweet
7430163363969158405,2024-12-02 17:11:41.677193,10-26,15.7K,mora.ghiso,Notion tour parte 2🍒 Toda la plantilla disponible en mi perfil :) ,#longervideos #notion #notiontour #setup #organization #notionapp ,https://www.tiktok.com/@mora.ghiso/video/7430163363969158405,https://www.tiktok.com/@mora.ghiso
7355644305844833542,2024-12-02 17:11:41.689192,4-8,34.4K,maiteuralde,"Este es el error más común que comete la gente a la hora de querer usar Notion gratis 😌 Resulta que las cuentas gratuitas de Notion tienen dos limitaciones: 1️⃣  Podrás tener máximo 10 invitados (si quieres entender más esto, ve el video del día 7). 2️⃣ Si añades un miembro a tu equipo, automáticamente tu cuenta tendrá un límite de 1000 bloques de contenido. Entonces, el error más común es que la gente añade miembros cuando no deben y al llegar al límite de 1000 bloques, te lleva a actualizar tu plan de Notion. Así que la clave está en manejar tu Notion con los 10 invitados, invitándolos solo a colaborar en las páginas o bases de datos que tengan que tener acceso. Así hago yo desde que uso Notion hace años y me ha funcionado bien. –– 💡 Si quieres usar Notion y prefieres tener un sistema de organización ya creado, échale un vistazo al Hub de mi Negocio en mi página web, una plantilla supercompleta con la que podrás gestionar todas las áreas de tu negocio de forma sencilla. 🔗 www.maiteuralde.com ",#notion #notionapp #notiontips #produtividad ,https://www.tiktok.com/@maiteuralde/video/7355644305844833542,https://www.tiktok.com/@maiteuralde
7407551470339444001,2024-12-02 17:11:41.702208,8-26,11.7K,notionconcarlos,Estas son mis actualizaciones favoritas de Notion del 2024! ,#notionapp #notiontemplate #notiontok #notiontutorial #notionenespañol #notiontips ,https://www.tiktok.com/@notionconcarlos/video/7407551470339444001,https://www.tiktok.com/@notionconcarlos
7271396031038835974,2024-12-02 17:11:41.725342,2023-8-25,111.7K,_coffeepaper.co,Respuesta a ,@Saul Gonzalez #notion #organizacion #estudiantes #emprendimiento ,https://www.tiktok.com/@_coffeepaper.co/video/7271396031038835974,https://www.tiktok.com/@_coffeepaper.co
7109597425836297477,2024-12-02 17:11:41.737105,2022-6-15,37.1K,jdlectures,Reply to ,#notion #medicina #estudiar #fyp ,https://www.tiktok.com/@jdlectures/video/7109597425836297477,https://www.tiktok.com/@jdlectures
7375950607040941345,2024-12-02 17:11:41.749123,6-2,3.6M,notionconcarlos,Los pequeños habitos empiezan a darte resultados por que decidiste invertir a largo plazo ,#notionapp #notiontemplate #productividadpersonal #planningtime #notiontok #notionenespañol ,https://www.tiktok.com/@notionconcarlos/video/7375950607040941345,https://www.tiktok.com/@notionconcarlos
7442058132857097527,2024-12-02 17:11:41.760242,Hace 5 día(s),638,mrs_notion,"Follow for more Notion hacks ✨ Formula: floor(1000 * (toNumber(prop(""Task 1"")) + toNumber(prop(""Task 2"")) + toNumber(prop(""Task 3"")) + toNumber(prop(""Task 4"")) + toNumber(prop(""Task 5"")) + toNumber(prop(""Task 6"")) + toNumber(prop(""Task 7"")) + toNumber(prop(""Task 8""))) / 8) / 1000 (number 8 depends the bumber of habits) ",#notion #notiontutorial #n #notiontemplaten #notiontok ,https://www.tiktok.com/@mrs_notion/video/7442058132857097527,https://www.tiktok.com/@mrs_notion
7273613147003555078,2024-12-02 17:11:41.770241,2023-8-31,25.9K,andreaiescorcia,amamos notion🌸🖊️🎧✨ ,#notionapp #notion #notiontok #journaling #panama ,https://www.tiktok.com/@andreaiescorcia/video/7273613147003555078,https://www.tiktok.com/@andreaiescorcia
7403149608064453893,2024-12-02 17:11:41.781243,8-14,6084,todoinorden,Lo que tienes que saber de las gráficas en Notion 📊✨ ,#notion #plantilla #notionespañol #tutorial ,https://www.tiktok.com/@todoinorden/video/7403149608064453893,https://www.tiktok.com/@todoinorden
7325100755843648774,2024-12-02 17:11:41.793242,1-17,93.4K,esmuybren,Notion para organizar todooo ,#organization #notionapp #comomeorganizo #organizacion #fyp #notion ,https://www.tiktok.com/@esmuybren/video/7325100755843648774,https://www.tiktok.com/@esmuybren
7431677843643305238,2024-12-02 17:11:41.804241,10-30,22.9K,notionconcarlos,En este tutorial de voy a mostrar como crear un tracker para gestionar mas facilmente tus proyectos ,#notion #notionapp #notiontemplate #notiontok #notiontutorial #notiontips #notionenespañol ,https://www.tiktok.com/@notionconcarlos/video/7431677843643305238,https://www.tiktok.com/@notionconcarlos
7371179445786397984,2024-12-02 17:11:41.816438,5-20,9989,notionconcarlos,Como evitar uno de los errores cuando estas empezando a usar Notion ,#notion #notionapp #notiontemplate #notiontips #notiontipsandtricks #notiontok #notionenespañol ,https://www.tiktok.com/@notionconcarlos/video/7371179445786397984,https://www.tiktok.com/@notionconcarlos
7355972617737620769,2024-12-02 17:11:41.828453,4-9,4037,notionconcarlos,Tutorial de Notion: como crear un tracker de habitos para registrar mas facilmente tus habitos ,#notion #notionapp #notiontutorial #notiontips #productividadpersonal ,https://www.tiktok.com/@notionconcarlos/video/7355972617737620769,https://www.tiktok.com/@notionconcarlos
7335187501457378592,2024-12-02 17:11:41.839772,2-13,15K,notionconcarlos,"Si estas buscando organizar mejor tus tareas, habitos y objetivos, entonces mira este tutorial de como crear una agenda semanal usando Notion ",#notion #notionapp #notiontemplate #notiontok #notiontutorial #notionenespañol ,https://www.tiktok.com/@notionconcarlos/video/7335187501457378592,https://www.tiktok.com/@notionconcarlos
7412732046398721312,2024-12-02 17:11:41.852758,9-9,2415,notionconcarlos,Asi es como puedes hacer publica una plantilla de Notion para que los demas la descarguen ,#notionapp #notiontemplate #notiontok #notiontutorial #notionenespañol #notiontips #notion #notionplanner ,https://www.tiktok.com/@notionconcarlos/video/7412732046398721312,https://www.tiktok.com/@notionconcarlos
7386775277872925984,2024-12-02 17:11:41.864843,7-1,13.4K,notionconcarlos,Como organizar tus notas facilmente en Notion ,#notion #notionapp #notiontemplate #notiontok #notiontutorial #notiontips ,https://www.tiktok.com/@notionconcarlos/video/7386775277872925984,https://www.tiktok.com/@notionconcarlos
7389350797269667105,2024-12-02 17:11:41.875158,7-8,22.2K,notionconcarlos,"Algo que me ayudo mucho a ser mas productivo fue la implementacion del segundo cerebro y adaptarlo en mi espacio de trabajo en Notion, sobre todo para organizar tareas! ",#notionapp #notion #notiontemplate #notiontok #notiontutorial #notiontips ,https://www.tiktok.com/@notionconcarlos/video/7389350797269667105,https://www.tiktok.com/@notionconcarlos
7168210349089393926,2024-12-02 17:11:41.887393,2022-11-20,33.5K,notionconcarlos,Recuerda que ,@Notion #notionapp #notion #notiontemplate #notiontemplate #notiontok #mexico #notionenespañol ,https://www.tiktok.com/@notionconcarlos/video/7168210349089393926,https://www.tiktok.com/@notionconcarlos
7436494023948258615,2024-12-02 17:11:41.898377,11-12,620,mrs_notion, You can have it in the description link in my profile✨,#notion #EnergiKuatTiapLangkah ,https://www.tiktok.com/@mrs_notion/video/7436494023948258615,https://www.tiktok.com/@mrs_notion
7296196393016904965,2024-12-02 17:11:41.908379,2023-10-31,28.6K,dianecoppo,"Soy fan de Notion hace 3 años, de verdad cambia la vida🤝💻 ",#chile #notion #organización #parati ,https://www.tiktok.com/@dianecoppo/video/7296196393016904965,https://www.tiktok.com/@dianecoppo
7351877621766049029,2024-12-02 17:11:41.919019,3-29,1858,juliusguc,Tenemos la nueva funciónde recorte de imágenes en Notion 🚀 ¿Que te parece? ,#notionperu #notion ,https://www.tiktok.com/@juliusguc/video/7351877621766049029,https://www.tiktok.com/@juliusguc
7272645995089939745,2024-12-02 17:11:41.930235,2023-8-29,12.5K,dailycerti,Io la uso sempre😍✨ ,#notionapp #notiontemplate #iphonericondizionati #certideal ,https://www.tiktok.com/@dailycerti/video/7272645995089939745,https://www.tiktok.com/@dailycerti
7344147836403059973,2024-12-02 17:11:41.941223,3-8,3181,condoble_ene,La mejor planilla de notion para crear tu plan de vida estrategico y tu mapa de accion para una vida mas productiva y alineada que te ayude a materializar tus sueños 🫶🏼 ,#notion #notionapp #notiontemplate #productividad #plandesccion #12weekyear #12weekyeartemplate ,https://www.tiktok.com/@condoble_ene/video/7344147836403059973,https://www.tiktok.com/@condoble_ene
7314720909405736198,2024-12-02 17:11:41.956224,2023-12-20,12.3K,cherry.iink,ˏˋ°•*⁀➷  ¿Cómo hacer Habit tracking en Notion? ☁️✨ Una de las cosas que más amo hacer en esta app es tablas de seguimiento de hábitos 🥰 Me encanta ver cuando todas las casillas están marcadas y he cumplido mi meta 😍 ♡ Puedes encontrar esta tabla de hábitos en mi Life Planner 2024 de Notion ☕️ ☁️ Pasos para hacer un Habit Tracker en tu Notion:  1. Crea una nueva tabla con el comando “/Table”  2. Selecciona la pestaña “Tags” y cambia el comando por “Check”  3. Agrega una pestaña de “Check” por cada día de la semana  4. Edita y recorre las casillas de la tabla hasta que te guste cómo quedó. Comenta si quieres un tutorial más detallado + una demostración de cómo hacer una barra de progreso.  💌 ¿Qué hábito te gustaría cambiar o comenzar a mejorar este 2024? Déjame saber en los comentarios ♥ 📎 En este Reel:  * App: Notion ✏️ * Página: Life Planner 2024 by CherryInk 🌸 ☁️🌷 Link en mi bio para comprar productos digitales en mi tienda de Etsy ✨ [Hashtags: ,#Notion #notionplanner #notiontemplate #digitalplanner #2024lifeplanner #newyear #ipadaesthetic #plannergram #studygram #productivelife #digitaltemplates #digitalproducts #etsyshop #thatgirlplanner #thatgirlaesthetic ,https://www.tiktok.com/@cherry.iink/video/7314720909405736198,https://www.tiktok.com/@cherry.iink
7322618207599086881,2024-12-02 17:11:41.970225,1-10,105.3K,mayclo.notion,2024 is the year to turn your life into a game 🏆 My notion templates are found at mayclo.co and my link in bio ♥️ ,#notion #notionapp #productivityplanner #notiontips #productivitysystem #notiontok #aestheticnotion #habittracker #notionweeklyplanner ,https://www.tiktok.com/@mayclo.notion/video/7322618207599086881,https://www.tiktok.com/@mayclo.notion
7327036845907365153,2024-12-02 17:11:41.982236,1-22,23.2K,notionconcarlos,Si ya descargaste el nuevo Calendario de Notion (Notion Calendar) pero aun no sabes como usarlo o conectarlo con tus bases de datos de Notion! En este tutorial aprenderas a hacerlo ,#notion #notionapp #notioncalendar #notionplanner #notiontemplate #notiontutorial #notionenespañol ,https://www.tiktok.com/@notionconcarlos/video/7327036845907365153,https://www.tiktok.com/@notionconcarlos
7310039666927897862,2024-12-02 17:11:41.995224,2023-12-7,43.1K,softly_juli,primera parte del tutorial de mi notion ♡ ,#notion #notiontok #notiontour #organizacion ,https://www.tiktok.com/@softly_juli/video/7310039666927897862,https://www.tiktok.com/@softly_juli
7399741761784007969,2024-12-02 17:11:42.008227,8-5,10.4K,notionconcarlos,"Si no sabes como organizar tus tareas, a veces la mejor forma es crear y diseñar tu propio sistema y de esa forma adaptarlo en una herramienta como Notion ",#notion #notionapp #notiontemplate #notiontok #notiontutorial #notionenespañol #notiontips ,https://www.tiktok.com/@notionconcarlos/video/7399741761784007969,https://www.tiktok.com/@notionconcarlos
7381566180475047201,2024-12-02 17:11:42.026238,6-17,33K,notionconcarlos,"Asi es como estoy usando Notion para registrar mis ingresos, gastos y ahorros de forma sencilla! ",#notion #notiontemplate #notiontok #notiontutorial #notiontips #notiontour #finanzaspersonales #finanzasinteligentes #notionenespañol ,https://www.tiktok.com/@notionconcarlos/video/7381566180475047201,https://www.tiktok.com/@notionconcarlos
7426417751977102598,2024-12-02 17:11:42.039224,10-16,38.2K,mora.ghiso,Notion tour🍒 ,#longervideos #notion #notiontour #setup #organization #notionapp ,https://www.tiktok.com/@mora.ghiso/video/7426417751977102598,https://www.tiktok.com/@mora.ghiso
7373770262954659104,2024-12-02 17:11:42.051222,5-27,16.8K,notionconcarlos,"Si trabajas con clientes y te gustaria usar Notion para apartar crear citas con ellos, este tip del Calendario de Notion te ayudara a gestionar mejot tus citas ",#notion #notionapp #notiontemplate #notiontok #notiontutorial #notionespañol #notionenespañol #notionplanning #clientes ,https://www.tiktok.com/@notionconcarlos/video/7373770262954659104,https://www.tiktok.com/@notionconcarlos
7289274035760876805,2024-12-02 17:11:42.063239,2023-10-12,810.1K,sarahgalvisg,Yo las amo ✨📲 ,#desarrollopersonal #crecimientopersonal #apps #productividad #organizacion ,https://www.tiktok.com/@sarahgalvisg/video/7289274035760876805,https://www.tiktok.com/@sarahgalvisg
7383864788641795333,2024-12-02 17:11:42.074101,6-23,30K,cosmyniki,🎀 ,#liferecently #foryou #studytok #aesthetic #pinknotion #notiontemplate #cutephone #pink #notion ,https://www.tiktok.com/@cosmyniki/video/7383864788641795333,https://www.tiktok.com/@cosmyniki
7318249306014616833,2024-12-02 17:11:42.086603,2023-12-29,104.5K,sumhea.studio,"If you’re struggle with Notion, try xTiles, it’s easier to set up 😆 ",#xTiles #notionalternative #digitalplanner #digitalplanning #2024planner #xtilespartner ,https://www.tiktok.com/@sumhea.studio/video/7318249306014616833,https://www.tiktok.com/@sumhea.studio
7309222115536948512,2024-12-02 17:11:42.099609,2023-12-5,79K,notionconcarlos,Mejora la forma en la que registras tus habitos y aumenta tu productividad ,#notion #notionapp #notiontemplate #notiontips #notionturorial #notionenespañol ,https://www.tiktok.com/@notionconcarlos/video/7309222115536948512,https://www.tiktok.com/@notionconcarlos
7400441257475968262,2024-12-02 17:11:42.110632,8-7,81.7K,pimauas,"mi video más pedido literalmente: acá esta, mi tutorial y cómo me organizo con notion <3 ",#notion #tutorialnotion #notionespañol #notionargentina #organizacion #aesthetic #argentina ,https://www.tiktok.com/@pimauas/video/7400441257475968262,https://www.tiktok.com/@pimauas
7344858743860956448,2024-12-02 17:11:42.122626,3-10,327.8K,notionconcarlos,"Y tu en que nivel estas? Si quieres aprender Notion pero no sabes como hacerlo, en mi canal de Youtube podras encontrar varios tutoriales de Notion en español gratuitos ",#notionapp #notiontemplate #notiontok #notiontutorial #notionenespañol #notionhacks ,https://www.tiktok.com/@notionconcarlos/video/7344858743860956448,https://www.tiktok.com/@notionconcarlos
7440621630012804408,2024-12-02 17:11:42.133070,11-23,580.1K,choy_and_music,Notion ,#musica #music #speesup #slowed ,https://www.tiktok.com/@choy_and_music/video/7440621630012804408,https://www.tiktok.com/@choy_and_music
7363357178356436230,2024-12-02 17:11:42.145070,4-29,5065,mindful_planning,tomar notas en Notion >>> ,#tipsparaestudiantes #takingnotes #students #universidad ,https://www.tiktok.com/@mindful_planning/video/7363357178356436230,https://www.tiktok.com/@mindful_planning
7427212781557943584,2024-12-02 17:11:42.158437,10-18,71.2K,magdacreativestudios,These are 3 Notion hacks for beginners that I loveee 🥺✨📔🌷📱🎧 ,#notiontemplate #notion #cutenotiontemplate #studioghiblinotion #productivity #notiontok #fyp #foryou #notionapp #notiongirlie #aestheticnotion #digitalplanner #anime #foodplanner #planneraddict #cuteplanner #getorganized #notiontips #notiontutorial #notiontutorialforbeginners #notionsetup #notiontracker ,https://www.tiktok.com/@magdacreativestudios/video/7427212781557943584,https://www.tiktok.com/@magdacreativestudios
7359994503253462304,2024-12-02 17:11:42.172109,4-20,14.3K,taskspaces,Upgrade your Notion workspace with these four websites🧠 ,#notion #notiontemplate #notiontips #organization #productivity #productivitysystem #notiontutorial #notionsetup #notionapp #digitalplanning ,https://www.tiktok.com/@taskspaces/video/7359994503253462304,https://www.tiktok.com/@taskspaces
7314371785213005089,2024-12-02 17:11:42.184119,2023-12-19,17.7K,notionconcarlos,"Asi es como uso Notion para organizar y planear mis dias y registrar mis habitos. Si necesitas ayuda o no sabes como usar Notion, entonces puedes descargar una de mis plantillas gratuitas ",#notionenespañol #notionapp #notiontok #notiontutorial #notiontemplate ,https://www.tiktok.com/@notionconcarlos/video/7314371785213005089,https://www.tiktok.com/@notionconcarlos
7323700783994768645,2024-12-02 17:11:42.195454,1-13,53.9K,softly_juli,para qué más lo podría usar? 🧺🌷,#notion #tutorial #organization #aesthetic #cute ,https://www.tiktok.com/@softly_juli/video/7323700783994768645,https://www.tiktok.com/@softly_juli
7240777780764413185,2024-12-02 17:11:42.210474,2023-6-4,688.5K,lin_notion,iPhoneのホーム画面カスタマイズが楽しすぎるんじゃああああ！！！😇😇 ,#notion活用 #notion #notion使い方 #おすすめアプリ #iphone便利機能 #ウィジットアレンジ #アイフォーン #iphone初心者 #ホーム画面 #ホーム画面カスタマイズ #ホーム画面の作り方 #ホーム画面アレンジ #ホーム画面おしゃれ ,https://www.tiktok.com/@lin_notion/video/7240777780764413185,https://www.tiktok.com/@lin_notion
7332121086634577158,2024-12-02 17:11:42.223335,2-5,177.4K,syifaaa_aul,Tutorial Notion Pemula part 1 | yuk comment mau tutor apalagi atau request bikin page apa dinotion ya💡💻. ,#notion #notiontemplate #notionapp #notiontutorial #productivity #productivityapp #notiontips ,https://www.tiktok.com/@syifaaa_aul/video/7332121086634577158,https://www.tiktok.com/@syifaaa_aul
7427587458717453600,2024-12-02 17:11:42.234344,10-19,8273,notionconcarlos,"Las formulas de Notion son un poco dificiles, pero cuando aprendes a usarlas se vuelve mas facil! ",#notion #notiontemplate #notionapp #notiontutorial #notiontok #notionenespañol ,https://www.tiktok.com/@notionconcarlos/video/7427587458717453600,https://www.tiktok.com/@notionconcarlos
7180252645112712453,2024-12-02 17:11:42.246944,2022-12-23,1.2M,lalnsi,| Notion - The Rare Occasions | ,#spotify #StumbleToVictory #spotifywrapped #spotifyonlyyou #candycrush10 #music #fyp #notion #therareoccasions ,https://www.tiktok.com/@lalnsi/video/7180252645112712453,https://www.tiktok.com/@lalnsi
7375521621450181920,2024-12-02 17:11:42.261947,6-1,128.6K,magdacreativestudios,These are my favorite Notion tips for someone that is just getting started with setting up their Notion 🥹📝🌱✨📔📱,#notiontemplate #notion #cutenotiontemplate #studioghiblinotion #productivity #notiontok #fyp #foryou #notionapp #notiongirlie #aestheticnotion #digitalplanner #anime #foodplanner #planneraddict #cuteplanner #getorganized #notiontips #notiontutorial #notiontutorialforbeginners #notionsetup #notiontracker ,https://www.tiktok.com/@magdacreativestudios/video/7375521621450181920,https://www.tiktok.com/@magdacreativestudios
7393858561073220870,2024-12-02 17:11:42.276431,7-20,12.8K,soobinejo,Respuesta a ,@:) #chile #fyp #digitaldiary #visualdiary #aesthetic #notion #notiontemplate #notiontour ,https://www.tiktok.com/@soobinejo/video/7393858561073220870,https://www.tiktok.com/@soobinejo
